"Fire monitoring system based on Open Map API","Kyung Jun Gil; Radius Bhayu Prasetiyo; Hyun Ju Park; Sang Boem Lim; Yang Dam Eo","Department of Advanced Technology Fusion, Konkuk University, Seoul, South Korea; Department of Advanced Technology Fusion, Konkuk University, Seoul, South Korea; Department of Advanced Technology Fusion, Konkuk University, Seoul, South Korea; Department of Advanced Technology Fusion, Konkuk University, Seoul, South Korea; Department of Advanced Technology Fusion, Konkuk University, Seoul, South Korea",The 6th International Conference on Networked Computing and Advanced Information Management,"16 Sep 2010","2010","","","600","605","Recently, large forest fire has resulted in a severe environmental catastrophe as well as considerable casualties and property damage. Therefore, the world has made a lot of efforts to come up with an effective forest fire-prevention and extinguishing method by monitoring the development of forest fire on a realtime basis and using the forest fire forecast system and satellite. In the past, large forest fire mostly occurred in countries where primeval forests prevail such as Southeast Asia, South America, China, Mongolia and Russia. Since the late 2000s, however, large forest fire started to occur in North America and Europe (ex: the U.S., Portugal, Spain, etc.) in which severe drought and hot weather lasted for a long time. It has caused a severe environmental catastrophe as well as considerable casualties and property damage. To minimize these forest damages, this paper has established a monitoring system which can implement visualization services by collecting GPS and sensor data based on the Micro System (Quad-Rotor).","","978-89-88678-26-8","","","https://ieeexplore.ieee.org/stamp/stamp.jsp?arnumber=5573231","Open Map API;Monitoring System;Visualization;Fire detection","Fires;Absorption;Companies","","","","14","","16 Sep 2010","","","IEEE","IEEE Conferences"
"FireFly Project: UAV Development for Distributed Sensing of Forest Fires","P. Puttapirat; K. Woradit; H. Hesse; D. Bhatia","Department of Computer Engineering, Faculty of Engineering, Chiang Mai University, Chiang Mai, Thailand; Department of Computer Engineering, Faculty of Engineering, Chiang Mai University, Chiang Mai, Thailand; School of Engineering, University of Glasgow, Glasgow, UK; School Science, Engineering & Technology, RMIT University, Vietnam",2024 International Conference on Unmanned Aircraft Systems (ICUAS),"19 Jun 2024","2024","","","594","601","Forest fires pose significant threats to ecosystems and communities globally. This paper explores the development of an automated system for forest fire monitoring and prevention, particularly focusing on regions around Northern Thailand. Despite recent applications of Unmanned Aerial Vehicles (UAVs) for fire detection, existing technologies face challenges in detecting early onset of fires in dense forests due to limited resolution and sensitivity of thermal cameras. To address this, this paper proposes a novel approach combining UAV-based surveying with ground-based Internet of Things (IoT) sensors to enable early detection of forest fires, even when obscured by tree canopies. The low-cost IoT sensors measure temperature, humidity and air quality at forest ground level. To overcome limitations in 4G communication for the IoT sensors, our system leverages UAVs as communication hubs to collect data from IoT sensors and survey the area for smoke and fire. The proposed system, part of the FireFly Project in collaboration with Chiang Mai University and the University of Glasgow, aims to overcome limitations of existing technologies and provide effective forest fire monitoring and prevention solutions. Experimental results presented in this paper demonstrate the performance of the distributed UAV-IoT system in detecting and communicating potential forest fires, paving the way for enhanced wildfire management strategies in fire-prone areas.","2575-7296","979-8-3503-5788-2","10.1109/ICUAS60882.2024.10556892","","https://ieeexplore.ieee.org/stamp/stamp.jsp?arnumber=10556892","UAV design;sensor nodes;distributed communication;wireless networks;IoT;forest fires","Temperature sensors;Temperature measurement;Protocols;Forestry;Infrared image sensors;Autonomous aerial vehicles;Sensor systems","","1","","16","IEEE","19 Jun 2024","","","IEEE","IEEE Conferences"
"Development of A Surveillance System to Detect Forest Fire and Smoke Using Deep Neural Networks","M. Subramanian; K. Shanmugavadivel; S. Muthusamy; M. Bajaj; O. Rubanenko; D. Danylchenko","Department of Computer Science and Engineering, Kongu Engineering College, Erode, India; Department of Computer Science and Engineering, Kongu Engineering College, Erode, Tamil Nadu, India; Department of Electronics and Communication Engineering, Kongu Engineering College (Autonomous), Erode, Tamil Nadu, India; Department of Electrical Engineering, Graphic Era (Deemed to be University), Dehradun, India; Department of Electrical Stations and Systems, Vinnytsia National Technical University, Vinnytsya, Ukraine; Department of Electric Power Transmission, National Technical University, «Kharkiv Polytechnic Institute», Kharkiv, Ukraine",2022 IEEE 3rd KhPI Week on Advanced Technology (KhPIWeek),"26 Oct 2022","2022","","","1","6","Forest fires are a major environmental hazard, causing economic, ecological, and human harm. Forest fires are natural flames that occur in forests, shrubs, and grasslands. Wildfires are usually caused by lightning or human error and occur during dry hot summers. Predicting such an environmental issue is crucial to reducing the threat. WSN is one of the innovative technologies and approaches developed to anticipate and detect forest fires. The accuracy of such fire detection technologies ranges from 80% to 91%. In this work, deep learning identification systems based on Convolutional Neural Networks (CNN) namely VGG16 and Mobile Net via Teachable Machine are presented to automatically detect fire in its early phases. Fire, No Fire, Smoke, and Smoke Fire are the four classes of images of forest fires identified in this work. With 98.5% accuracy on the Fire Image dataset, Mobile Net via Teachable machine outperforms the literature when it comes to predicting the fire.","","979-8-3503-9920-2","10.1109/KhPIWeek57572.2022.9916483","","https://ieeexplore.ieee.org/stamp/stamp.jsp?arnumber=9916483","Forest Fire;Convolutional Neural Network (CNN);Fire Images Dataset;VGG16;Mobile Net;Teachable Machine;Accuracy","Deep learning;Training;Wireless sensor networks;Surveillance;Neural networks;Fires;Forestry","","2","","18","IEEE","26 Oct 2022","","","IEEE","IEEE Conferences"
"Design of a Drone that Applies Multisensor Information for the Early Detection of Forest Fires","H. H. Rivera Paredes; W. C. Muños Suazo; J. G. Acero Calderón; S. A. Chamorro Quijano","Department of Mechatronic Engineering, Universidad Continental, Huancayo, Perú; Department of Mechatronic Engineering, Universidad Continental, Huancayo, Perú; Department of Mechatronic Engineering, Universidad Continental, Huancayo, Perú; Department of Mechatronic Engineering, Universidad Continental, Huancayo, Perú","2023 3rd International Conference on Robotics, Automation and Artificial Intelligence (RAAI)","26 Jul 2024","2023","","","20","26","The article focuses on the design and development of a drone equipped with advanced technology for the early detection of wildfires, a major threat to the environment, human life and property. Early detection is essential for effective response. This drone has multiple advanced sensors, including thermal cameras, high-resolution cameras and gas sensors, allowing it to continuously and accurately monitor forest areas. Its autonomous and programmable operation capability makes it an efficient tool for regular patrols over critical areas. The fire detection system is based on real-time analysis of thermal and high-resolution images captured by the drone. Computer vision algorithms process these images to identify early signs of fire, such as changes in temperature, smoke or presence of fire. When a potential fire is detected, the drone notifies authorities immediately. The advanced technology applied in this drone has the potential to save lives, reduce property damage and preserve the environment. This innovative approach to early wildfire detection shows great potential for the protection of vulnerable ecosystems and the safety of communities.","","979-8-3503-0756-6","10.1109/RAAI59955.2023.10601205","","https://ieeexplore.ieee.org/stamp/stamp.jsp?arnumber=10601205","fire;mapping;detection;process;system","Temperature sensors;Temperature measurement;Wildfires;Temperature;Forestry;Cameras;Thermal analysis","","","","18","IEEE","26 Jul 2024","","","IEEE","IEEE Conferences"
"Estimating Low-Power Radio Signal Attenuation in Forests: A LiDAR-Based Approach","S. Demetri; G. P. Picco; L. Bruzzone","Department of Information Engineering and Computer Science (DISI), University of Trento, Italy; Department of Information Engineering and Computer Science (DISI), University of Trento, Italy; Department of Information Engineering and Computer Science (DISI), University of Trento, Italy",2015 International Conference on Distributed Computing in Sensor Systems,"23 Jul 2015","2015","","","71","80","Wireless sensor networks offer unprecedented opportunities to monitor natural ecosystems. However, despite the growing number of applications (e.g., Forest fire detection, wildlife monitoring), the deployment challenges posed by the real-world natural environment still hinder the widespread adoption of this technology. In particular, the unpredictability of the low-power wireless channel in the presence of vegetation requires costly trial-and-error pilot campaigns to understand where and how to place the wireless nodes. In this paper, we propose a technique based on remote sensing for accurately estimating low-power radio signal attenuation in forest environments. We leverage airborne Light Detection and Ranging (LiDAR) instruments and related automatic data analysis systems to determine local forest attributes (e.g., Tree density) that, once factored into a specialized radio path loss model, enable accurate estimation of the received signal power. Our approach is i) automatic, i.e., It does not require in-field campaigns, and ii) fine-grained, i.e., It enables per-link estimates. Our validation from deployments in a real forest shows that the error of our per-link estimates of the received signal power is around ± 6 dBm - the accuracy of RSSI readings from the radio transceiver.","2325-2944","978-1-4799-8856-3","10.1109/DCOSS.2015.17","","https://ieeexplore.ieee.org/stamp/stamp.jsp?arnumber=7165025","low-power wireless communication;wireless sensor networks;remote sensing;LiDAR;IEEE 802.15.4","Vegetation;Laser radar;Wireless sensor networks;Vegetation mapping;Wireless communication;Estimation;Attenuation","","9","","32","IEEE","23 Jul 2015","","","IEEE","IEEE Conferences"
"Optical design of long-distant and directional flame detection based on pyroelectric sensor","Wu Haibin; Zhuang Kunsen; Liu Bo; Zheng Hongqing","School of Mechanical Engineering and Automation, Fuzhou University, Fuzhou, China; School of Mechanical Engineering and Automation, Fuzhou University, Fuzhou, China; School of Mechanical Engineering and Automation, Fuzhou University, Fuzhou, China; School of Mechanical Engineering and Automation, Fuzhou University, Fuzhou, China",2010 IEEE International Conference on Intelligent Computing and Intelligent Systems,"6 Dec 2010","2010","2","","83","87","As the viewing range of the existing fire detection devices is normally short, and directional detection of the flame can not be achieved, it can not be used in many cases. An optical design and implementation based on flame pyroelectric sensor are present in this paper. Two types of directional flame detection are provided. One is to achieve plane-type directional detection, and the other is to achieve line-type directional detection. For plane-type directional detection, the optical viewing angle design of detection device in the horizontal and vertical direction is asymmetric. The viewing angle of vertical direction is much bigger than that of horizontal direction in order to detect the flame anywhere in vertical plane as far as possible. On the other hand, the viewing angle of horizontal direction is expected to be smaller so as to ensure directional flame detection. The size of viewing angle is controlled within a certain range through a special optical design including lens and slit. The design of line-type directional detection is achieved based on ultra-small viewing angle of the lens. Based on such design of flame detectors, the detection range can be adjusted by changing the optical parameters, so long-distance flame detection can be achieved. This scheme has a broad application prospects in many fields, such as forest fire prevention, automatic fire cannons, etc., because of directional flame detection. Experiments show that this method has achieved the expected results.","","978-1-4244-6585-9","10.1109/ICICISYS.2010.5658848","","https://ieeexplore.ieee.org/stamp/stamp.jsp?arnumber=5658848","flame detection;directional detection;long distance;optical design","Fires;Optical sensors;Variable speed drives;Lenses","","","","10","IEEE","6 Dec 2010","","","IEEE","IEEE Conferences"
"Environmental Fire Hazard Detection and Prediction using Random Forest Algorithm","R. Thakkar; V. Abhyankar; P. D. Reddy; S. Prakash","Department of Electrical Engineering, Arizona State University, Arizona, USA; Department of Embedded Technology, Vellore Institute of Technology, Vellore, India; Department of Communication Engineering, Vellore Institute of Technology, Vellore, India; Department of Electronics and Communication Engineering, Indian Institute of Information Technology Allahabad, Prayagraj, India",2022 International Conference for Advancement in Technology (ICONAT),"10 Mar 2022","2022","","","1","4","Forest fire has become an issue that looms over the entire world, mainly because of climate change. This can be catastrophic for humans as well as animals. This paper aims at detecting and predicting potential wildfires using Random Forest Algorithm. Forest fire data from the Montesinho natural park in Portugal's Tras-os-Montes upper east zone, collected over three years, is used in this study (January 2000 to December 2003). The data used is linearly correlated and helps detect the ideal environmental conditions for a fire-Pearson's method to make predictions and raise the alarm to avoid the worst. Based on Random Forest regression, a correlation matrix was obtained with an absolute mean error of 0.66. Hence, this method can be deployed for the effective prediction of the forest fire.","","978-1-6654-2577-3","10.1109/ICONAT53423.2022.9726029","","https://ieeexplore.ieee.org/stamp/stamp.jsp?arnumber=9726029","correlation matrix;fire detection and prediction;Pearson's correlation coefficient;random forest algorithm","Wireless sensor networks;Climate change;Correlation;Fires;Forestry;Predictive models;Prediction algorithms","","4","","14","IEEE","10 Mar 2022","","","IEEE","IEEE Conferences"
"Green IoT Framework for Deep Forest Surveillance","P. S. Raju; S. Lakshmi Priya.; S. Ksheeraja.; B. Menaga.; V. Ragul.","Department of Electronics and Communication Engineering, SRM Valliammai Engineering College, Kattankulathur, India; Department of Electronics and Communication Engineering, SRM Valliammai Engineering College, Kattankulathur, India; Department of Electronics and Communication Engineering, SRM Valliammai Engineering College, Kattankulathur, India; Department of Electronics and Communication Engineering, SRM Valliammai Engineering College, Kattankulathur, India; Department of Electronics and Communication Engineering, SRM Valliammai Engineering College, Kattankulathur, India","2023 International Conference on Signal Processing, Computation, Electronics, Power and Telecommunication (IConSCEPT)","10 Jul 2023","2023","","","1","5","Forests are one of the essential natural resources required to preserve the planet’s ecological equilibrium. This paper offers a technique for creating an extensive environmental monitoring system. Along with that, it keeps an check over illegal activities taking place nearby, such as invasion into reserved forest areas and natural calamities like forest fire. The datas will be captured, classified, and reported to the official by the device. This can be accomplished by interfacing various sensors like an flame sensor, an ultrasonic sensor, and a DHT sensor with Arduino Nano board. Additionally, it offers guidance on safety measures and has the capacity to forecast natural calamities. Results are compared to numerous cutting-edge methods for figuring out total performance. The concern of finite energy supplies, however, affects the sensor nodes used in such networks. Keeping this concern in mind, energy can be saved to a greater extend by implementing green IoT technologies. The continual changes in temperature and humidity may be observed using the Adafruit cloud platform. The internet connectivity that connects Arduino to the Adafruit platform is provided by Node MCU. Wi-Fi is the transmission technique used in this. Real-time application of Lora WAN technology is possible to link sensors to cloud platforms.","","979-8-3503-1212-6","10.1109/IConSCEPT57958.2023.10170016","","https://ieeexplore.ieee.org/stamp/stamp.jsp?arnumber=10170016","Arduino Integrated Development Environment;Green IoT;sleep scheduling;sensor nodes;Adafruit;Wi-Fi;Internet of Things","Cloud computing;Green products;Fires;Forestry;Humidity;Real-time systems;Acoustics","","1","","15","IEEE","10 Jul 2023","","","IEEE","IEEE Conferences"
"Modeling Unreliable Data and Sensors: Using F-measure Attribute Performance with Test Samples from Low-Cost Sensors","V. Iyer; S. S. Iyengar","Louisiana State University, Baton Rouge, LA, USA; Louisiana State University, Baton Rouge, LA, USA",2011 IEEE 11th International Conference on Data Mining Workshops,"23 Jan 2012","2011","","","15","22","Building a high performance classifier requires training with labeled data, which is supervised and allows generalizing the classifier's decision boundary and in practice most of the data is unlabeled, newer algorithms needs to be learn by knowledge discovery. Sufficient training data are collected in the form of empirical evidence, which have labeled positive and negative samples to build the hypothesis. The hypothesis is constructed by the conjunction of the attributes, which can be learnt by machine learning algorithm. In this paper, we work with two forms of ranking weights, precision and relevance, which help in finding hidden patterns and prediction future events. Empirical evidence for a weather patterns and tracking of a phenomenon needs to accurately extract the attributes and label the training samples, which is a very laborious and time-consuming effort. Automating weather prediction algorithms, which are trained by supervised learning, needs to be generalized so that it can be tested with unreliable and noisy weather data from low cost sensors. We use a training data from previous forest fires events, the datasets containing all the attributes are labeled using manual data logs for a given geographical area. The labeled original dataset is mapped to the data collected from on-line sensors, which further improves the accuracy of the training set. As some of classes have very few samples, which are related to the peak fire seasons, domain specific knowledge are added by sensor measurements and Fire Weather Index (FWI) to help accurately model the events. We show that training accuracy of the small forest fire classifier using attributes from manual logs is enhanced by 30% by using sensor data. The rare and hard to classify large forest fires are 95% accurately classified by using the new Fire Weather Index (FWI). We also show that our framework is more robust to outliers from noisy sensor measurements by accounting for in the model parameters. The model allows further generalization for linearly and non-linearly separable datasets by estimating the parameters (1-δ) and minimum allowable error ϵ for hypothesis, sampling accuracy and cross validation.","2375-9259","978-1-4673-0005-6","10.1109/ICDMW.2011.124","","https://ieeexplore.ieee.org/stamp/stamp.jsp?arnumber=6137355","Sampling sensors;Dataming;Machine Learning;Ranking functions;IR;Event Modeling;Forest fires;FWI;Temporal Patterns;Sensor Networks","Sensor phenomena and characterization;Meteorology;Mathematical model;Accuracy;Indexes;Barium","","1","","20","IEEE","23 Jan 2012","","","IEEE","IEEE Conferences"
"Space-based Sensorweb monitoring of wildfires in Thailand","S. Chien; J. Doubleday; D. Mclaren; A. Davies; D. Tran; V. Tanpipat; S. Akaakara; A. Ratanasuwan; D. Mandl","Jet Propulsion Laboratory, California Institute of Technology, USA; Jet Propulsion Laboratory, California Institute of Technology, USA; Jet Propulsion Laboratory, California Institute of Technology, USA; Jet Propulsion Laboratory, California Institute of Technology, USA; Jet Propulsion Laboratory, California Institute of Technology, USA; Wildlife and Plant Conservation Department, Thailand; Wildlife and Plant Conservation Department, Thailand; Wildlife and Plant Conservation Department, Thailand; NASA Goddard Space Flight Center, USA",2011 IEEE International Geoscience and Remote Sensing Symposium,"20 Oct 2011","2011","","","1906","1909","We describe efforts to apply sensorweb technologies to the monitoring of forest fires in Thailand. In this approach, satellite data and ground reports are assimilated to assess the current state of the forest system in terms of forest fire risk, active fires, and likely progression of fires and smoke plumes. This current and projected assessment can then be used to actively direct sensors and assets to best acquire further information. This process operates continually with new data updating models of fire activity leading to further sensing and updating of models. As the fire activity is tracked, products such as active fire maps, burn scar severity maps, and alerts are automatically delivered to relevant parties. We describe the current state of the Thailand Fire Sensorweb which utilizes the MODIS-based FIRMS system to track active fires and trigger Earth Observing One / Advanced Land Imager to acquire imagery and produce active fire maps, burn scar severity maps, and alerts. We describe ongoing work to integrate additional sensor sources and generate additional products.","2153-7003","978-1-4577-1005-6","10.1109/IGARSS.2011.6049497","","https://ieeexplore.ieee.org/stamp/stamp.jsp?arnumber=6049497","Forest fires;Active Fire Mapping;Burn Scar Assessment;Carbon Cycle;Sensorweb","Fires;Satellites;Remote sensing;Monitoring;MODIS;Sensors;Earth","","12","","13","IEEE","20 Oct 2011","","","IEEE","IEEE Conferences"
"Detecting selective forwarding attacks in wireless sensor networks","Bo Yu; Bin Xiao","Department of Computer Science and Engineering, Fudan University, Shanghai, China; Department of Computing, Hong Kong Polytechnic University, Kowloon, Hong Kong, China",Proceedings 20th IEEE International Parallel & Distributed Processing Symposium,"26 Jun 2006","2006","","","8 pp.","","Selective forwarding attacks may corrupt some mission-critical applications such as military surveillance and forest fire monitoring. In these attacks, malicious nodes behave like normal nodes in most time but selectively drop sensitive packets, such as a packet reporting the movement of the opposing forces. Such selective dropping is hard to detect. In this paper, we propose a lightweight security scheme for detecting selective forwarding attacks. The detection scheme uses a multi-hop acknowledgement technique to launch alarms by obtaining responses from intermediate nodes. This scheme is efficient and reliable in the sense that an intermediate node reports any abnormal packet loss and suspect nodes to both the base station and the source node. To the best of our knowledge, this is the first paper that presents a detailed scheme for detecting selective forwarding attacks in the environment of sensor networks. The simulation results show that even when the channel error rate is 15%, simulating very harsh radio conditions, the detection accuracy of the proposed scheme is over 95%.","1530-2075","1-4244-0054-6","10.1109/IPDPS.2006.1639675","","https://ieeexplore.ieee.org/stamp/stamp.jsp?arnumber=1639675","","Intelligent networks;Wireless sensor networks;Base stations;Fires;Military computing;Surveillance;Error analysis;Routing protocols;Computer science;Application software","","48","1","20","IEEE","26 Jun 2006","","","IEEE","IEEE Conferences"
