"Sensor Deployment and Link Analysis in Satellite IoT Systems for Wildfire Detection","H. -H. Liu; R. Y. Chang; Y. -Y. Chen; I. -K. Fu; H. V. Poor","Academia Sinica, Research Center for Information Technology Innovation, Taiwan; Academia Sinica, Research Center for Information Technology Innovation, Taiwan; Academia Sinica, Research Center for Environmental Changes, Taiwan; MediaTek Inc.; Department of Electrical and Computer Engineering, Princeton University, USA",GLOBECOM 2022 - 2022 IEEE Global Communications Conference,"11 Jan 2023","2022","","","5631","5636","Climate change has been identified as one of the most critical threats to human civilization and sustainability. Wildfires, which produce huge amounts of carbon emission, are both drivers and results of climate change. An early and timely wildfire detection system can constrain fires to short and small ones and yield significant carbon reduction. In this paper, we propose to use ground sensor deployment and satellite Internet of Things (loT) technologies for wildfire detection by taking advantage of satellites' ubiquitous global coverage. We first develop an optimal loT sensor placement strategy based on fire ignition and detection models. Then, we analyze the uplink satellite communication budget and the bandwidth required for wildfire detection under the narrowband loT (NB-IoT) radio interface. Finally, we conduct simulations on the California wildfire database and quantify the potential economical benefits by factoring in carbon emission reductions and sensorlbandwidth costs.","2576-6813","978-1-6654-3540-6","10.1109/GLOBECOM48099.2022.10001073","Ministry of Science and Technology(grant numbers:MOST 109-2221-E-00I-013-MY3,MOST 109-2918-1-001-003); ","https://ieeexplore.ieee.org/stamp/stamp.jsp?arnumber=10001073","Internet of Things (loT);non-terrestrial network (NTN);satellite communication;wildfire detection","Sensor placement;Climate change;Satellite broadcasting;Fires;Carbon dioxide;Internet of Things;Uplink","","4","","23","IEEE","11 Jan 2023","","","IEEE","IEEE Conferences"
"Wireless communication-based smoke detection system design for forest fire monitoring","Z. He; Y. Fang; N. Sun; X. Liang","Institute of Robotics and Automatic Information System, Robotics Nankai University, Tianjin, China; Institute of Robotics and Automatic Information System, Robotics Nankai University, Tianjin, China; Institute of Robotics and Automatic Information System, Robotics Nankai University, Tianjin, China; Institute of Robotics and Automatic Information System, Robotics Nankai University, Tianjin, China",2016 31st Youth Academic Annual Conference of Chinese Association of Automation (YAC),"5 Jan 2017","2016","","","475","480","Based on wireless communication technology, this paper designs a smoke detection system out of the need for forest fire monitoring. Firstly, this paper designs the hardware scheme for the key functional modules, and implements the integration of the entire system, as well as the functional debugging at the platform. Based on the hardware design, the overall scheme of software system is set up, which successfully gets through the experimental debugging. For communication, the data received from the sensor nodes is collected by a router to a coordinator, and subsequently sent to the GPRS module through a serial port. Finally, the information is shown on the PC through the Internet. The overall system satisfies the particular need of forest environment monitoring, and presents a good prospect of application and promotion.","","978-1-5090-4423-8","10.1109/YAC.2016.7804941","","https://ieeexplore.ieee.org/stamp/stamp.jsp?arnumber=7804941","forest fire detection;ZigBee;General Packet Radio Service","Decision support systems;ZigBee;Ground penetrating radar;Power supplies;Microprocessors;Wireless communication;Protocols","","4","","12","IEEE","5 Jan 2017","","","IEEE","IEEE Conferences"
"An Improved Algorithm Based on D-S Evidence Theory for Accurate Wildfire Detection","Q. Li; P. Yan; B. Chen; J. Cai; Z. Ding; R. Ye","Metering Center State Grid Sichuan Electric Power Company, Chengdu, China; Metering Center State Grid Sichuan Electric Power Company, Chengdu, China; School of Automation Engineering, University of Electronic Science and Technology of China, Chengdu, China; Metering Center State Grid Sichuan Electric Power Company, Chengdu, China; School of Automation Engineering, University of Electronic Science and Technology of China, Chengdu, China; School of Automation Engineering, University of Electronic Science and Technology of China, Chengdu, China",2023 2nd Asian Conference on Frontiers of Power and Energy (ACFPE),"11 Mar 2024","2023","","","34","39","Accurately predicting wildfire before they occur is a challenging task. D-S evidence theory can make use of collected data to predict wildfire. Due to the possible conflict of the collected data, the accuracy of the theory is not high in predicting the mountain fire. In order to solve this problem, this paper improved the traditional D-S evidence theory, combined with the theory of hierarchical analysis to reduce the conflict between data, and finally improve the accuracy of mountain fire prediction. In this paper, the accuracy rate of risk prediction and cost expenditure are used as the measurement basis for accurately predicting mountain fires. When the accuracy of risk prediction is higher, the accuracy of mountain fire prediction algorithm is higher. The lower the cost used, the higher the accuracy of the fire prediction algorithm. The risk prediction accuracy of the improved D-S evidence theory is 1, which is 40% higher than the traditional accuracy. The cost of the improved D-S evidence theory is 11 units less than that of the traditional theory. Therefore, the improved D-S evidence theory algorithm can predict the mountain fire more accurately.","","979-8-3503-0389-6","10.1109/ACFPE59335.2023.10455486","","https://ieeexplore.ieee.org/stamp/stamp.jsp?arnumber=10455486","wildfire predicting;D-S theory;data fusion","Costs;Wildfires;Evidence theory;Prediction algorithms;Task analysis","","","","9","IEEE","11 Mar 2024","","","IEEE","IEEE Conferences"
"Wildfire Detection and Avoidance of false Alarm Using Densenet","S. P; R. D. N; S. S; S. A; S. C","Department of ECE, Sri Ramakrishna Engineering College, Coimbatore, Tamilnadu, India; Department of ECE, Sri Ramakrishna Engineering College, Coimbatore, Tamilnadu, India; Department of ECE, Sri Ramakrishna Engineering College, Coimbatore, Tamilnadu, India; Department of ECE, Sri Ramakrishna Engineering College, Coimbatore, Tamilnadu, India; Department of ECE, Saveetha Engineering College, Chennai, Tamilnadu, India",2022 13th International Conference on Computing Communication and Networking Technologies (ICCCNT),"26 Dec 2022","2022","","","1","4","The environmental crisis leaves human livelihood at stake. One such catastrophic situation humans tend to face is wildfire, and the damages it creates are uncertain. Fire-like objects and small-size fire objects have a high false alarm rate. Wildfire is one of the most common hazards and natural threats to biodiversity, disturbing the ecology and environment of a region. Natural causes such as lightning and man-made causes are significant sources of forest fires. If the wildfire goes unnoticed, it cannot be controlled quickly, and hence the impact of these disastrous effects can result in massive damage to human properties and areas of vegetation. On average, 62,963 wildfires occur worldwide annually and affect millions of hectares. And such impacts could be avoided if there were systems available for monitoring and early detection of the wildfire. Flame detectors, smoke detectors, and temperature detectors are examples of early fire detection technologies that are inadequate in the event of a widespread wildfire. Sensor-based and image-processing-based technology is two types of existent technology. On the other hand, with the help of real-time surveillance cameras, constant and accurate monitoring under deep learning-based automatic wildfire detection is possible. Hence we initiate architecture with DenseNet for wildfire detection and avoidance of false alarms, using a mixed dataset of fire-like objects and non-fire objects which is definitive for wildfire detection excluding false alarms","","978-1-6654-5262-5","10.1109/ICCCNT54827.2022.9984493","","https://ieeexplore.ieee.org/stamp/stamp.jsp?arnumber=9984493","Wildfire;DenseNet;CNN","Temperature sensors;Temperature;Biological system modeling;Surveillance;Fires;Vegetation mapping;Detectors","","2","","10","IEEE","26 Dec 2022","","","IEEE","IEEE Conferences"
"Forest Fire Detection using Nine-Layer Deep Convolutional Neural Network","P. K. Sethy; A. G. Devi; P. K. Sahoo; A. K. Nath; T. Sahoo; S. S. Patra","Department of Electronics, Sambalpur University, Burla, India; Department of ECE, PVP Siddhartha Institute of Technology, Vijayawada, AP; Department of ECE, SUIIT, Burla, India; Department of ECE, SUIIT, Burla, India; Department of ECE, SUIIT, Burla, India; Department of ECE, SUIIT, Burla, India","2023 Fifth International Conference on Electrical, Computer and Communication Technologies (ICECCT)","21 Jul 2023","2023","","","1","4","Forest fires (FF) may endanger human life and ecological, environmental, and natural resource systems. However, such disasters can be lessened, and an automated early FF detection surveillance system can protect the ecosystem. We proposed a FF fighting system and created a nine-layer deep convolutional neural network to discern between photographs of fire and no fire. The suggested model achieves 96.71% classification accuracy following rigorous simulation. The recommended work is more accurate than the earlier work.","","978-1-6654-9360-4","10.1109/ICECCT56650.2023.10179789","","https://ieeexplore.ieee.org/stamp/stamp.jsp?arnumber=10179789","forest fire;fire detection;convolutional neural network;deep learning;image processing","Natural resources;Biological system modeling;Surveillance;Computational modeling;Ecosystems;Forestry;Communications technology","","","","28","IEEE","21 Jul 2023","","","IEEE","IEEE Conferences"
"Experimental Evaluation of Smart Forest Fire Detection Methodology using Internet of Things and Logical Sensors","V. Balaji Vijayan; T. Dhanalakshmi; P. Parthasarathi; S. Nivedha; R. Krishnamoorthy; R. Thiagarajan","Department of ISE, HKBK college of Engineering, Bengaluru, India; Department of CSE, Jerusalem College of Engineering, Chennai, India; Department of CSE, Bannari Amman Institute of Technology, Sathyamangalam, Erode, India; Department of CSE, Hindusthan College of Engineering and Technology, Coimbatore, India; Centre for Advanced Wireless Integrated Technology, Chennai Institute of Technology, Chennai, India; Department of IT, Prathyusha Engineering College, Chennai, India",2024 10th International Conference on Communication and Signal Processing (ICCSP),"6 Jun 2024","2024","","","603","608","Forest fires typically involve accidents; the destruction of forests poses a significant threat to both humans and other wildlife. The term Internet of Things (IoT) refers to the network of interconnected physical devices that allow everyday items to communicate with one another and share data over an online network The primary goal of this article is to use temperature, humidity, and other variables to forecast the fire’s future trajectory. To improve the efficacy of the fire detection process, an Internet of Things (IoT) based system may receive data on humidity and temperature from a variety of sensors. For the purpose of avoiding the need to achieve high reliability prevention, the proposed Io T based forest fire detection mechanism (IoTFFD) can use a threshold value of each sensor to validate the data. To test how well the scheme worlss, it is cross-validated with the conventional Smart Forest Fire Identifier (SFFI). This system presents the architecture of an IoT framework for monitoring and avoiding forest fires. To avoid a disaster (a forest fire) that could lead to the loss of many natural resources, wildlife, and human lives, it is necessary to first understand how to integrate a valid network architecture that can detect possible changes in the ecosystem. This will allow us to begin investigating the causes of forest fires and developing effective prevention strategies. Our device’s primary function is to use GSM, a buzzer, and the Internet of Things to identify a forest fire and sound an alert. A variety of sensors are integrated into the system’s architecture; these sensors are crucial for identifying forest fires and notifying local residents. In addition, the monitored region may be tracked in real-time through the IOT portal. In addition, we have included a defensive setup that uses a servo motor to water the area surrounding the setup in the event of a small fire.","2836-1873","979-8-3503-5306-8","10.1109/ICCSP60870.2024.10543364","","https://ieeexplore.ieee.org/stamp/stamp.jsp?arnumber=10543364","Forest Fire Detection;Internet of Things;Logical Sensors;IoT;SFFI;IoTFFD;NodeMCU;Wildlife Prevention;Environmental Safety","Temperature sensors;Temperature distribution;Wildlife;Ecosystems;Forestry;Humidity;Sensor systems","","5","","15","IEEE","6 Jun 2024","","","IEEE","IEEE Conferences"
"Advanced Forest Fire Alert System with Real-time GPS Location Tracking","C. Venkateswara Rao; C. Vandana; M. K. V. S. Reddy; K. S. Raju; R. V. P. Sirisha; H. Killamsetti","Department of ECE, Vishnu Institute of Technology, Bhimavaram, INDIA; Department of ECE, B V Raju Institute of Technology, Narsapur, Telangana, India; Department of ECE, Vishnu Institute of Technology, Bhimavaram, INDIA; Department of Physics and Electronics, B V Raju College, Bhimavaram, INDIA; Department of ECE, B V Raju Institute of Technology, Narsapur, Telangana, India; Department of ECE, Vishnu Institute of Technology, Bhimavaram, INDIA","2023 2nd International Conference on Automation, Computing and Renewable Systems (ICACRS)","26 Jan 2024","2023","","","95","99","The advanced forest fire alert system with real-time GPS location tracking is a cutting-edge solution designed to enhance forest fire detection and response capabilities. This system leverages state-of-the-art technology to provide real-time monitoring of forested areas, enabling the rapid identification of potential fire outbreaks. By integrating GPS location tracking, the system ensures accurate and timely positioning data, facilitating swift deployment of firefighting resources to the exact location of the fire. This study presents the architecture, components, and operational workflow of this innovative system, highlighting its potential to revolutionize forest fire management. The proposed system primarily centers around the development of a fire detection system utilizing the ESP 32 microcontroller, which is interconnected with an MQ3 sensor, a flame sensor, and a Neo 6m GPS module. Initially, these two sensors will be deployed within forested areas to identify occurrences of fire and smoke. Upon detection of fire or smoke, the GPS module will be activated to pinpoint the location. Through the utilization of the GPS module, the detected location of fire or smoke is transmitted via the Blynk app, and an alarm is triggered. In contrast to the current method, wherein sensors transmit information about potential forest fire locations to an Arduino for subsequent GPS-based detection and SMS alerting via GSM, this proposed system streamlines the process by integrating real-time GPS tracking and immediate alerting through the Blynk app.","","979-8-3503-4023-5","10.1109/ICACRS58579.2023.10404409","","https://ieeexplore.ieee.org/stamp/stamp.jsp?arnumber=10404409","Forest Fire Detection;Firefighting Resources;Real-time GPS Location Tracking;Global positioning system;Sensor Integration;Forest Fire Management;Emergency Preparedness","Microcontrollers;Wildlife;Sociology;Forestry;Real-time systems;Statistics;Global Positioning System","","1","","23","IEEE","26 Jan 2024","","","IEEE","IEEE Conferences"
"Forest Wild Fire Detection using Deep Learning Approach","A. S. K; M. D; A. A. Mary G; S. B; P. M; A. B. C","Department of ECE, Vel Tech Rangarajan Dr.Sagunthala R&D Institute of Science and Technology, Chennai, India; Department of ECE, Vel Tech Rangarajan Dr.Sagunthala R&D Institute of Science and Technology, Chennai, India; Department of ECE, Vel Tech Rangarajan Dr.Sagunthala R&D Institute of Science and Technology, Chennai, India; Department of ECE, Vel Tech Rangarajan Dr.Sagunthala R&D Institute of Science and Technology, Chennai, India; Department of ECE, Vel Tech Rangarajan Dr.Sagunthala R&D Institute of Science and Technology, Chennai, India; Department of ECE, Vel Tech Rangarajan Dr.Sagunthala R&D Institute of Science and Technology, Chennai, India",2023 9th International Conference on Smart Structures and Systems (ICSSS),"31 Jan 2024","2023","","","1","3","Disasters are happening inrecent times around the world. One of the major disasters which have drawn the most attention is the large area fires, especially forest areas. Forest fires can occur naturally and also sometimes by humans. Forest Fires just does not harm the plants and trees of the forest, but also the animalsliving in the forest. It also affects the nearby places where humans live since smoke, carbon dioxide and carbon mono-oxide concentration increase inthe atmosphere which can lead to several health problems such as respiratory problems. We can detect the fire by deploying various wireless sensor nodes in the forest areas by which they sense the fire and can inform us, so that we can control the damage to be done by forest fire. We can increase the efficiency of discovery exhausting different approaches on the information collected by various wireless sensor nodes. In this report we will compare some of the machine learning techniques used by researchers with wireless sensor nodes in predicting forest fire.","","979-8-3503-8420-8","10.1109/ICSSS58085.2023.10407055","","https://ieeexplore.ieee.org/stamp/stamp.jsp?arnumber=10407055","Forest Fire;WSN;Correlation;Sensors","Wireless communication;Wireless sensor networks;Machine learning algorithms;Disasters;Forestry;Vegetation;Prediction algorithms","","","","10","IEEE","31 Jan 2024","","","IEEE","IEEE Conferences"
"A UAV Forest Fire Detection Method Based on Dual-Light Vision Images","X. Xie; J. Wang; Y. Zhang; J. Xin; L. Mu; X. Xue","Department of Automation and Information Engineering, Xi’an University of Technology, Xi’an, China; Department of Automation and Information Engineering, Xi’an University of Technology, Xi’an, China; Department of Mechanical, Industrial and Aerospace Engineering Concordia University, Montreal, Canada; Department of Automation and Information Engineering, Xi’an University of Technology, Xi’an, China; Department of Automation and Information Engineering, Xi’an University of Technology, Xi’an, China; Department of Automation and Information Engineering, Xi’an University of Technology, Xi’an, China","2023 CAA Symposium on Fault Detection, Supervision and Safety for Technical Processes (SAFEPROCESS)","3 Nov 2023","2023","","","1","6","The forest fires have numerous hazards and effects on environment. Unmanned aerial vehicle (UAV) can provide important help for forest fire detection with fast and flexible response features. In order to detect the occurrence of forest fire(s) effectively and quickly, a UAV-based forest fire detection method is proposed with dual-light vision images. The main idea of the method is to use visible light images in YCrCb color space and infrared (IR) grayscale images to get flame mask to complete flame detection. Meanwhile, visible light images in HSV color space is used to get smoke mask to complete smoke detection even for possible earlier fire detection. Finally, the proposed method is verified using DJI M300 RTK UAV platform with H20T camera as onboard sensor.","","979-8-3503-3775-4","10.1109/SAFEPROCESS58597.2023.10295827","National Natural Science Foundation of China; ","https://ieeexplore.ieee.org/stamp/stamp.jsp?arnumber=10295827","UAV;Dual-light image;Forest fire detection","Image color analysis;Fires;Forestry;Gray-scale;Autonomous aerial vehicles;Feature extraction;Cameras","","3","","18","IEEE","3 Nov 2023","","","IEEE","IEEE Conferences"
"Wi-Fi HaLow Wildfire Sound Detector","S. Rizanov; P. Yakimov","Faculty of Electronic Engineering and Technologies, Technical University of Sofia 8 Kliment Ohridski blvd., Sofia, Bulgaria; Faculty of Electronic Engineering and Technologies, Technical University of Sofia 8 Kliment Ohridski blvd., Sofia, Bulgaria",2024 XXXIII International Scientific Conference Electronics (ET),"23 Oct 2024","2024","","","1","6","The expanding severity and occurrences of wildfires has led researchers in search for new technologies and applying cutting-edge solutions for the early detection of such fire hazards. Within this work we propose a Wi-Fi HaLow wildfire sound detector. Described are the spectral specifics of forest fire noise, the Wi-Fi HaLow standard and its advantages. The prototyped system was subjected to tests capturing real sound data from fire and non-fire events and distinguishing between them by means of sonogram analysis.","","979-8-3503-7644-9","10.1109/ET63133.2024.10721479","Technical University of Sofia; ","https://ieeexplore.ieee.org/stamp/stamp.jsp?arnumber=10721479","audible noise;embedded system;forest fire noise;sound detection;wildfire;Wi-Fi HaLow","Wireless communication;Wildfires;Sonogram;Reviews;Detectors;Transient analysis;Wireless fidelity;Standards;Spectrogram;Testing","","","","12","IEEE","23 Oct 2024","","","IEEE","IEEE Conferences"
"Low Cost LoRa based Network for Forest Fire Detection","R. Vega-Rodríguez; S. Sendra; J. Lloret; P. Romero-Díaz; J. L. Garcia-Navas","Departamento de Teoría de la Señal, Telemática y Comunicaciones (TSTC), Universidad de Granada, Granada, Spain; Departamento de Teoría de la Señal, Telemática y Comunicaciones (TSTC), Universidad de Granada, Granada, Spain; Instituto de Investigación para la Gestion Integrada de zonas Costeras (IGIC), Universitat Politècnica de València, València, Spain; Departamento de Teoría de la Señal, Telemática y Comunicaciones (TSTC), Universidad de Granada, Granada, Spain; Instituto de Investigación para la Gestion Integrada de zonas Costeras (IGIC), Universitat Politècnica de València, València, Spain","2019 Sixth International Conference on Internet of Things: Systems, Management and Security (IOTSMS)","23 Dec 2019","2019","","","177","184","Forest fires are one of the main environmental problems in the entire Mediterranean basin. In a context where low power and long-range networks (LPWAN) are increasingly common to the rise of Internet of Things (IoT) architecture, the interest in providing solutions to monitor scenarios and fire prevention based on these technologies is huge. This paper presents a low cost Long Range (LoRa) based network able to evaluate level of fire risk and the presence of a forest fire. The system is composed by a LoRa node and a set of sensors to measure the temperature, relative humidity, wind speed and CO2. The evaluation algorithm is based on the 3030-30 rule. Through website the users can see the parameters measured by nodes in real time. The system has been tested in a real environment and the results show that it is possible to cover a circular area of 1.1km or radius.","","978-1-7281-2949-5","10.1109/IOTSMS48152.2019.8939193","","https://ieeexplore.ieee.org/stamp/stamp.jsp?arnumber=8939193","wireless sensor networks (WSN);LoRa;forest fire detection;Arduino;Dragino;The Think Networks (TTN)","Forestry;Wireless sensor networks;Indexes;Temperature measurement;Monitoring;Temperature sensors","","32","","20","IEEE","23 Dec 2019","","","IEEE","IEEE Conferences"
"Forest Fire Monitoring System Based on UAV Team, Remote Sensing, and Image Processing","V. Sherstjuk; M. Zharikova; I. Sokol","Kherson National Technical University, Kherson, Ukraine; Kherson National Technical University, Kherson, Ukraine; Maritime Institute of Postgraduate Education, Kherson, Ukraine",2018 IEEE Second International Conference on Data Stream Mining & Processing (DSMP),"4 Oct 2018","2018","","","590","594","This work presents the fire monitoring and detecting system for tactical forest fire-fighting operations based on a team of unmanned aerial vehicles, remote sensing, and image processing. The idea of such a system and its general parameters and possibilities are described. Functions and missions of the system, as well as its architecture, are considered. The image processing and remote sensing algorithms are presented, a way for data integration into a real-time DSS is proposed. The results of experimental research of the prototype system are presented. The combination of multi-UAV-based automatic monitoring, remote sensing and image processing techniques provides required credibility and efficiency of the fire detection.","","978-1-5386-2874-4","10.1109/DSMP.2018.8478590","","https://ieeexplore.ieee.org/stamp/stamp.jsp?arnumber=8478590","unmanned air vehicles;forest fire monitoring;remote sensing;image processing;fire detection","Fires;Forestry;Monitoring;Remote sensing;Sensors;Image processing;Task analysis","","25","","15","IEEE","4 Oct 2018","","","IEEE","IEEE Conferences"
