"Fire Detection Systems by Using Wireless Sensors","M. P. Aryan; U. Srilakshmi; D. Venkatesulu","Department of CSE, VFSTR Deemed to be University, Vadlamudi, India; Department of CSE, VFSTR Deemed to be University, Vadlamudi, India; Department of CSE, VFSTR Deemed to be University, Vadlamudi, India",2022 IEEE International Conference on Data Science and Information System (ICDSIS),"14 Oct 2022","2022","","","1","4","Forest fires have become a serious concern all across the globe, wreaking havoc on human homes and forest ecosystems alike. Some of the repercussions of such damage include climatic shifts and the greenhouse effect. Surprisingly, human-caused forest fires account for a larger proportion of all forest fires. As a result, it is necessary to identify forest fires early on in order to reduce the amount of damage caused by them. This research presents three distinct methods and approaches for employing a wireless sensor network to identify forest fires in their early stages. A solution may easily be implemented as an independent system for extended durations due to the main power supply supplied by rechargeable batteries with a secondary solar power source. Furthermore, in order to limit the damage and detrimental impacts produced by wild animals and weather conditions to the system, special attention is paid to sensor node design and node location requirements in difficult forest settings. Several experiments in genuine tropical forest areas revealed that the various technologies are successful at detecting forest fires with high accuracy.","","978-1-6654-9801-2","10.1109/ICDSIS55133.2022.9915930","","https://ieeexplore.ieee.org/stamp/stamp.jsp?arnumber=9915930","forest fire detection;global system for mobile communication;wireless sensor network;deep learning;machine learning","Wireless communication;Wireless sensor networks;Power supplies;Forestry;Network architecture;Transceivers;Batteries","","1","","25","IEEE","14 Oct 2022","","","IEEE","IEEE Conferences"
"IOT Based Forest Fire Detection and Extinguishing System","S. D. S; N. D. S; A. R; P. S. H. G","Department of Computer Science and Engineering (5 Years Integrated), Sri Sairam Engineering College, Chennai, India; Department of Computer Science and Engineering (5 Years Integrated), Sri Sairam Engineering College, Chennai, India; Department of Computer Science and Engineering (5 Years Integrated), Sri Sairam Engineering College, Chennai, India; Department of Computer Science and Engineering (5 Years Integrated), Sri Sairam Engineering College, Chennai, India","2024 International Conference on Power, Energy, Control and Transmission Systems (ICPECTS)","12 Dec 2024","2024","","","1","5","A forest fire detection system integrating deep learning and IoT for timely and accurate wildfire detection. Surveillance cameras in forests capture visual data, analyzed by deep learning algorithms to distinguish smoke or flames, ensuring low false alarm rates. The system uses an Arduino Uno with an IR sensor to detect wind direction, displaying updates on an LCD and transmitting data to a cloud server via an ESP8266 microcontroller for remote monitoring. Python-based image processing enhances fire detection. This comprehensive solution improves early fire detection and response, contributing to effective forest fire prevention and mitigation [1].","","979-8-3315-0884-5","10.1109/ICPECTS62210.2024.10779987","","https://ieeexplore.ieee.org/stamp/stamp.jsp?arnumber=10779987","Deep Learning;Image Recognition;Internet of Things (IoT);Wildfire Detection;Surveillance Cameras;Flame Detection;False Alarm Reduction;Early Fire Detection;Wind mill;Micro Controller;Forest Fire Prevention;Mitigation Strategies;Environmental Monitoring","Deep learning;Visualization;Wildfires;Accuracy;Prevention and mitigation;Surveillance;Biological system modeling;Forestry;Cameras;Reliability","","","","10","IEEE","12 Dec 2024","","","IEEE","IEEE Conferences"
"Circle-based approximation to forest fires with distributed wireless sensor networks","M. Á. Serna; A. Bermudez; R. Casado","Instituto de Investigación en Informática, Universidad de Castilla-La Mancha, Albacete, Spain; Instituto de Investigación en Informática, Universidad de Castilla-La Mancha, Albacete, Spain; Instituto de Investigación en Informática, Universidad de Castilla-La Mancha, Albacete, Spain",2013 IEEE Wireless Communications and Networking Conference (WCNC),"15 Jul 2013","2013","","","4329","4334","Disaster management is one of the most promising application fields of wireless sensor networks. In this work we focus on forest fire fighting operations. The role of the sensor network deployed in this scenario will consist in obtaining a representation (or a model) of the fire fronts, and distribute it to the firefighters in the area, in such a way they are aware of the risks they are assuming at each time. To achieve it, sensor nodes are able to determine their position, to detect the presence of fire (by monitoring the evolution of the ambient temperature), and to distribute this information wirelessly through the network. In this way, each firefighter maintains a fire representation consisting of a list of circles centered at the received positions. In this paper, we propose and analyze three criteria to assign the size of these circles. Simulation results show that a dynamic approach based on network density perceived by a node detecting fire offers an accurate approximation to the forest fire, without introducing a significant overhead.","1558-2612","978-1-4673-5939-9","10.1109/WCNC.2013.6555274","","https://ieeexplore.ieee.org/stamp/stamp.jsp?arnumber=6555274","Wireless sensor networks;disaster management;phenomena monitoring;forest fire modeling","Fires;Shape;Approximation methods;Wireless sensor networks;Temperature sensors;Monitoring;Temperature measurement","","2","","27","IEEE","15 Jul 2013","","","IEEE","IEEE Conferences"
"Research on Binocular Forest Fire Source Location and Ranging System","Z. Yaping; S. Zhihang","School of Mechanical and Electrical Engineering, Northeast Forestry University, Harbin, China; School of Mechanical and Electrical Engineering, Northeast Forestry University, Harbin, China","2020 IEEE International Conference on Power, Intelligent Computing and Systems (ICPICS)","22 Sep 2020","2020","","","199","202","The system under OpenCV environment was studied to realize the localization and ranging of forest fire sources effectively. The forest fire was identified by using the solar-blind ultraviolet-infrared binocular detector, and a gyroscope measured the azimuth. With the switching function of the binocular sensor, the ranging binocular part of the system can be activated. The equipment that has completed camera calibration and binocular image correction uses the SGBM algorithm to perform binocular matching and obtain a disparity map. Then the three-dimensional transformation of coordinates can be completed to get the ranging result under the OpenCV environment. The system adopts ultraviolet sun-blind imaging monitoring technology to eliminate the interference of sunlight and utilizes SGBM algorithm, which has the advantages of fast processing speed and distinct processing effect. The obtained parallax map provides a reliable basis for binocular ranging; thus, it has a minor error. This system has realized the binocular forest fire source localization and ranging, with advantages of self-sensing, self-identification, self-triggering, so it has a great automatic extent. It has advanced significantly in the forest fire location and range.","","978-1-7281-9874-3","10.1109/ICPICS50287.2020.9201975","","https://ieeexplore.ieee.org/stamp/stamp.jsp?arnumber=9201975","forest fire;binocular ranging;SGBM algorithm;OpenCV;solar blind ultraviolet","Fires;Cameras;Forestry;Distance measurement;Calibration;Stereo vision;Optical filters","","2","","13","IEEE","22 Sep 2020","","","IEEE","IEEE Conferences"
"Forest Fire Detection using Computer Vision","P. R. A; G. P. Praneash; T. Rashmika; A. Natarajan","Department of Computer Science and Engineering, PSG Institute of Technology and Applied Research, Coimbatore, India; Department of Computer Science and Engineering, PSG Institute of Technology and Applied Research, Coimbatore, India; Department of Computer Science and Engineering, PSG Institute of Technology and Applied Research, Coimbatore, India; Department of Computer Science and Engineering, PSG Institute of Technology and Applied Research, Coimbatore, India",2022 3rd International Conference on Electronics and Sustainable Communication Systems (ICESC),"19 Sep 2022","2022","","","1094","1103","Every year, approximately 70,000 wildfires occur around the world. Forest fires can have a variety of negative effects on forest cover, soil, tree development, vegetation, and general flora and fauna. Fires destroy several hectares of forest and leave behind ash, rendering it unfit for vegetation growth. Animal habitats are destroyed by the heat created by the fire. Preventing fire disasters and saving people’s lives and property requires early detection of fires before they become catastrophic. These forest fires must be detected and put out as early as possible. In this project a computer vision based deep learning model is proposed that can detect and alert in-case of forest fires. The model which is used here is called MobileNet Architecture which employs depth-wise separable convolutions and has greater advantages than using other currently existing models. The model is trained from a dataset that was scrapped from the internet. The computer vision model is built utilizing the packages in Python 3 such as NumPy, OpenCV, Pillow, Matplotlib, and TensorFlow. This method is created by training and testing the model to identify failures and establish recovery strategies. As a result, these computer vision-based systems can provide a warning at an early stage of fire, which is critical for forest fire early warning.","","978-1-6654-7971-4","10.1109/ICESC54411.2022.9885250","","https://ieeexplore.ieee.org/stamp/stamp.jsp?arnumber=9885250","MobileNet Architecture;computer vision;Model Training and Validation;Optimization;Loss and Loss Function;Precision;Model Testing","Training;Computer vision;Computational modeling;Image edge detection;Vegetation mapping;Forestry;Computer architecture","","5","","15","IEEE","19 Sep 2022","","","IEEE","IEEE Conferences"
"Smart Sensor System for Detection and Forecasting Forest Fire Hotspot in Riau Province Indonesia","E. A. Kadir; M. Othman; S. L. Rosa","Department of Informatics Engineering, Universitas Islam Riau, Pekanbaru, Indonesia; Department of Informatics Engineering, Universitas Islam Riau, Pekanbaru, Indonesia; Department of Informatics Engineering, Universitas Islam Riau, Pekanbaru, Indonesia",2021 International Congress of Advanced Technology and Engineering (ICOTEN),"27 Jul 2021","2021","","","1","6","Indonesian is one of the countries in a tropical region, in the summer season normally high temperature and hot environmental then forest and forest fire happened. This is because most of the land in Indonesia is peatland and forestry area, especially in Sumatera and Kalimantan island. Worst when it has a huge impact on the local economy, environment, flora, fauna and human health. As reported, millions of people have suffered from respiratory problems, which some have died and in serious health conditions. This research aims to prevent more casualties, providing detection and forecasting as well as warning on fires as alert to the community and representative institution. Furthermore, the research discusses on developing a smart sensing system for the ground level to do monitoring and forecasting. Several types of sensor used based on fire basic parameters such as temperature, humidity, gasses and carbon sensor to measure value in the open environment. Arduino microcontroller and algorithm introduce to the system to achieve smart monitoring system and filtering noise data from the sensors. Mathematical model and analysis applied in this system to do forecasting for the future and estimate number of hotspots in the area of forest in Riau Province. The information based on sensing and analysis as well as forecast data forward to the respective institution or government agency for further action.","","978-1-6654-1224-7","10.1109/ICOTEN52080.2021.9493535","Ministry of Education; Universitas Islam Riau; Universiti Teknologi Petronas; ","https://ieeexplore.ieee.org/stamp/stamp.jsp?arnumber=9493535","Smart Sensing;Forest Fire;Detection;Forecasting;Riau Indonesia","Temperature measurement;Temperature sensors;Microcontrollers;Biological system modeling;Forestry;Predictive models;Data models","","7","","24","IEEE","27 Jul 2021","","","IEEE","IEEE Conferences"
"IOT Enabled Forest Fire Identification and Prevention System using LORA","G. Sudha; S. Saranya; S. Subbiah; B. Rajalakshmi; M. Archana; J. S. Shalini","Department of Electronics and Communication Engineering, Sri Sairam Engineering College, Chennai, India; Department of Electronics and Communication Engineering, Sri Sairam Engineering College, Chennai, India; Department of Information Technology, Sri Sairam Engineering College, Chennai, India; Department of Electronics and Communication Engineering, Sri Sairam Engineering College, Chennai, India; Department of Electronics and Communication Engineering, Sri Sairam Engineering College, Chennai, India; Department of Electronics and Communication Engineering, Sri Sairam Engineering College, Chennai, India",2024 10th International Conference on Communication and Signal Processing (ICCSP),"6 Jun 2024","2024","","","142","146","An IOT based fire detection and alert system is presented for monitoring forest fires remotely. Here, a certain environment is watched over around-the-clock, and the user is informed in the event of any fatal circumstances. The temperature and the presence of smoke are the two variables being continuously tracked here. This work employs a NodeMCU and other sensors to detect and measure numerous physical characteristics that can increase during a fire-related incident. The ESP8266 WiFi module is built into the NodeMCU IOT-based controller board. A temperature sensor LM35 is used to measure temperature and a gas sensor MQ6 is used to detect the presence of smoke since it can identify and measure any carbon-based gas, including CO2, which smoking creates. This module can be used in any location for monitoring activities.","2836-1873","979-8-3503-5306-8","10.1109/ICCSP60870.2024.10544320","","https://ieeexplore.ieee.org/stamp/stamp.jsp?arnumber=10544320","Fire detection;LORA;IOT;Sensors;NodeMCU","Temperature measurement;Temperature sensors;Temperature;Transmitters;Forestry;Signal processing;Sensor phenomena and characterization","","","","10","IEEE","6 Jun 2024","","","IEEE","IEEE Conferences"
"Design and implementation of a Wireless Sensor Network to detect forest fires","J. Granda Cantuña; D. Bastidas; S. Solórzano; J. -M. Clairand","Facultad de Ingeniería y Ciencias Agropecuarias, Universidad de las Américas, Quito, Ecuador; Facultad de Ingeniería y Ciencias Agropecuarias, Universidad de las Américas, Quito, Ecuador; Facultad de Ingeniería y Ciencias Agropecuarias, Universidad de las Américas, Quito, Ecuador; Institute for Energy Engineering, Universitat Politècnica de València, Valencia, Spain",2017 Fourth International Conference on eDemocracy & eGovernment (ICEDEG),"3 Jul 2017","2017","","","15","21","In this paper, an innovative design and development process is presented for a Wireless Sensor Network (WSN) prototype aimed at detecting and monitoring forest fires at the Guanguiltagua Park located in the Metropolitan District of Quito (DMQ), capital of Ecuador. Every year the city of Quito is affected by recurrent forest fires, especially in summer time where high temperatures and soil dryness contribute to the propagation of fire in areas with vast vegetation. As a result to this problem, a WSN technological solution was created to address this problem which can detect forest fires in real-time sending alerts immediately to the end user. This prompt response helps to attenuate the impact of forest fires such as loss of human lives, loss of large areas of vegetation, economic loss and environmental contamination. The WSN prototype described in this document uses hardware, software, communication protocols, topology and functionality focused on optimizing its end results. The system is based on measuring continuously three types of gases, which are present in a combustion process such as CO2, CO and CH4. In addition to these sensors, environment temperature and humidity, as well as GPS location data is provided; this data is transmitted via wireless communications toward a graphical interface where the sensors data will be interpreted and statistical information can be generated. Finally, through a WSN prototype validation process, it is demonstrated that such prototype provides an efficient and reliable method to detect and monitor forest fires in a short amount of time.","","978-1-5090-4830-4","10.1109/ICEDEG.2017.7962508","","https://ieeexplore.ieee.org/stamp/stamp.jsp?arnumber=7962508","Wireless Sensor Network;Forest Fire Detection;Real-Time;Communication Protocol;Database;eGovernment","Wireless sensor networks;Temperature sensors;Temperature measurement;Prototypes;Humidity;Real-time systems","","15","","26","IEEE","3 Jul 2017","","","IEEE","IEEE Conferences"
"Optimizing Deep Learning Accuracy: Visibility Filtering Approach for Early Wildfire Detection in Forest Sensor Images","N. A. Walee; A. Shalan; C. Kadlec; M. K. Rahman","College of Engineering and Computing, Georgia Southern University, Statesboro, GA, USA; College of Engineering and Computing, Georgia Southern University, Statesboro, GA, USA; College of Engineering and Computing, Georgia Southern University, Statesboro, GA, USA; School of Earth, Environment and Sustainability, Georgia Southern University, Statesboro, GA, USA","2024 IEEE/ACIS 9th International Conference on Big Data, Cloud Computing, and Data Science (BCD)","8 Nov 2024","2024","","","59","64","Due to the destruction caused by wildfires underscores the critical need for proactive wildfire management strategies. Particularly, early detection of wildfires can mitigate their impact on the environment and economic loss and save human lives. This research study builds upon our prior work on refining and improving identifying early-stage wildfires. Previous research focused on using a deep-learning model for detecting early wildfires. This study aims to classify the visibility levels of forest sensory images to improve the deep learning model. Due to the constraints of existing public wildfire detection datasets, we have created a specialized forest sensory images dataset tailored specifically for detecting wildfires in their initial stages. We have used an Open-source computer vision library (OpenCV) for image processing integrated with TensorFlow and Keras to create a hybrid deep learning model. The results showed a significant improvement in the accuracy from 84% to 87% in detecting early spots of fire in images captured by surveillance cameras or/satellites. The Convolutional Neural Network model has been evaluated by crucial classification metrics, including accuracy, precision, recall, and f1 values. The study aids in progressing the efficacy of early wildfire detection, furnishing valuable perspectives for urban centers and nations contending with the dangers presented by these catastrophic natural events.","","979-8-3503-9419-1","10.1109/BCD61269.2024.10743078","","https://ieeexplore.ieee.org/stamp/stamp.jsp?arnumber=10743078","Early Wildfire;Dataset;Visibility Filtering;OpenCV;CNN;Image Classification;Sensory Images","Deep learning;Training;Wildfires;Accuracy;Filtering;Computational modeling;Surveillance;Forestry;Convolutional neural networks;Software development management","","","","23","IEEE","8 Nov 2024","","","IEEE","IEEE Conferences"
"Machine Learning-Based Forest Fire Forecasting: Mitigating Environmental Hazards","J. Kanjalkar; P. Kanjalkar; P. Golegaonkar; D. Bissa; I. Borade; P. Ratnalikar; T. Bora","Computer Science and Engineering(Artificial Intelligence Vishwakarma Institute of Technology, Pune, India; Computer Science and Engineering(Artificial Intelligence Vishwakarma Institute of Technology, Pune, India; Computer Science and Engineering(Artificial Intelligence Vishwakarma Institute of Technology, Pune, India; Computer Science and Engineering(Artificial Intelligence Vishwakarma Institute of Technology, Pune, India; Computer Science and Engineering(Artificial Intelligence Vishwakarma Institute of Technology, Pune, India; Computer Science and Engineering(Artificial Intelligence Vishwakarma Institute of Technology, Pune, India; Computer Science and Engineering(Artificial Intelligence Vishwakarma Institute of Technology, Pune, India",2024 IEEE International Conference on Smart Power Control and Renewable Energy (ICSPCRE),"25 Nov 2024","2024","","","1","5","Forest fires, or wildfires, are natural phenomena that have shaped ecosystems for ages. They result from both natural causes like lightning and human factors such as campfires or arson. While some fires are beneficial, maintaining biodiversity and nutrient cycling, human-induced fires can have devastating consequences. They can lead to habitat loss, worsen air quality, release carbon emissions, and cause economic damage. Notable historical events, like the Great Fire of 1910 and the 2019 Amazon Rainforest fires, illustrate the far-reaching impacts of these fires, emphasizing the need for comprehensive fire management in the face of evolving climate patterns. This research aimed at developing a robust machine learning model for early detection of forest fires, has made noteworthy progress. Recent efforts have led to a substantial increase in prediction accuracy through","","979-8-3503-7700-2","10.1109/ICSPCRE62303.2024.10675176","","https://ieeexplore.ieee.org/stamp/stamp.jsp?arnumber=10675176","Forest Fire;Machine Learning;FFMC;DMC;Ridge Regression;Random Forest","Renewable energy sources;Accuracy;Machine learning algorithms;Wildfires;Forestry;Predictive models;Prediction algorithms","","","","15","IEEE","25 Nov 2024","","","IEEE","IEEE Conferences"
"Data Mining Approach to Predict Forest Fire Using Fog Computing","R. S. Aakash; M. Nishanth; R. Rajageethan; R. Rao; R. Ezhilarasie","Computer Science and Engineering Dept., SASTRA Deemed University, Thanjavur, India; Computer Science and Engineering Dept., SASTRA Deemed University, Thanjavur, India; Computer Science and Engineering Dept., SASTRA Deemed University, Thanjavur, India; Computer Science and Engineering Dept., SASTRA Deemed University, Thanjavur, India; School of Computing, SASTRA Deemed University, Thanjavur, India",2018 Second International Conference on Intelligent Computing and Control Systems (ICICCS),"10 Mar 2019","2018","","","1582","1587","Fires caused in forests are known to be one of the most hazardous environmental issues which cannot be neglected. Fast and quick prediction is the only way by which we can at least face it with readily available fire extinguishing resources. To accomplish this, one of the best ways is to use automatic tools based on locally placed sensors, such as rain, thermal readings, relative dampness and wind. In this work, we inquire a Data Mining (DM) approach to predict the area prone to forest fire. SVM (Support Vector Machine) algorithm is used for live sensor data. SVM algorithm utilizes four sensor inputs related to weather info data (i.e. thermal data, relative dampness, rain and wind velocity) and it is feasible to predict the burned land zone due to small fires, which are periodic or frequent. Awareness about those zones are utilized for developing and deploying fire fighting resource management. The data received from the sensor devices are processed in individual fog nodes and the cumulative data is collected upon and is used for further analysis. The data transfer happens wirelessly via Zig-Bee tool. The results obtained is utilized to predict the areas which are prone to and will be affected by sudden outburst of forest fire.","","978-1-5386-2842-3","10.1109/ICCONS.2018.8663160","","https://ieeexplore.ieee.org/stamp/stamp.jsp?arnumber=8663160","Internet of Things (IoT);Fog based computing;Canadian Forest Fire Index;Support Vector Machine (SVM)","Fires;Forestry;Support vector machines;Edge computing;Sensors;Wind speed;Rain","","4","","15","IEEE","10 Mar 2019","","","IEEE","IEEE Conferences"
